{
  "adapter_mode": "official-sdk-raw-response",
  "base_url_fingerprint": "sha256:43ca9a0c843bda0d8d777b0750850df9126503353bc5d8d514d21bb3ac26c493",
  "capabilities": {
    "native_tools": true,
    "opaque_continuation_support": true,
    "parallel_tool_calls": false,
    "reasoning_support": false,
    "strict_tool_schema": false,
    "thinking_support": true
  },
  "model": "replace-with-model",
  "parallel_tool_calls": false,
  "profile_id": "sha256:cce9cc18b052692b0609b338fcc885644b046d7872f9add618b37b1c4094c223",
  "provider": "replace-with-local-profile-name",
  "retry": {
    "pico_provider_attempts": 1,
    "sdk_max_retries": 0
  },
  "schema_version": "pico-native-provider-profile-v1",
  "sdk": {
    "package": "anthropic",
    "version": "0.117.0"
  },
  "stream": false,
  "wire_dialect": "anthropic-messages"
}
